{
  "schemaVersion": "1.0",
  "purpose": "explain-dependency",
  "question": "¿Por qué Orders depende de Payment?",
  "graphRevision": 523,
  "focusIds": [
    "c4:orders",
    "c4:payment"
  ],
  "compareIds": [],
  "evidenceIds": [
    "ev:src-orders-184"
  ],
  "lensHint": "evidence-path",
  "overlayHints": [
    "authority",
    "confidence"
  ]
}
